[
  {
    "hypothesis_id": "hyp-0001",
    "entity_id": "ent-src-102211a6-9d1d-477e-a081-e5ef0756cf9a",
    "hypothesis_label": "compact_cluster",
    "hypothesis_level": "morphological",
    "confidence": 0.6992857142857143,
    "supporting_evidence": [
      "ev-ent-ent-src-102211a6-9d1d-477e-a081-e5ef0756cf9a",
      "ev-geom-102211a6-9d1d-477e-a081-e5ef0756cf9a",
      "ev-rel-rel-aligned-4",
      "ev-rel-rel-coplanar-candidate-3",
      "ev-rel-rel-near-1",
      "ev-rel-rel-parallel-5",
      "ev-rel-rel-touching-candidate-2"
    ],
    "contradicting_evidence": [],
    "alternatives": [
      "morphological_pattern",
      "ambiguous_entity"
    ],
    "missing_information": [
      "verified geometric interaction required",
      "pending: tolerance_review",
      "pending: face_adjacency_check",
      "pending: brep_contact_check"
    ],
    "status": "candidate"
  },
  {
    "hypothesis_id": "hyp-0002",
    "entity_id": "ent-src-8276da53-2a80-4eb0-859c-a51d37bf9a0a",
    "hypothesis_label": "compact_cluster",
    "hypothesis_level": "morphological",
    "confidence": 0.6992857142857143,
    "supporting_evidence": [
      "ev-ent-ent-src-8276da53-2a80-4eb0-859c-a51d37bf9a0a",
      "ev-geom-8276da53-2a80-4eb0-859c-a51d37bf9a0a",
      "ev-rel-rel-aligned-4",
      "ev-rel-rel-coplanar-candidate-3",
      "ev-rel-rel-near-1",
      "ev-rel-rel-parallel-5",
      "ev-rel-rel-touching-candidate-2"
    ],
    "contradicting_evidence": [],
    "alternatives": [
      "morphological_pattern",
      "ambiguous_entity"
    ],
    "missing_information": [
      "verified geometric interaction required",
      "pending: tolerance_review",
      "pending: face_adjacency_check",
      "pending: brep_contact_check"
    ],
    "status": "candidate"
  }
]